{
  "schema": "teaching_skill_miner.teacher_agent_multiturn_benchmark.v1",
  "description": "面向长程记忆、图片证据、Skill 动态切换、知识正确性、画像隔离与终止行为的作者构造多轮对抗开发集。",
  "benchmark_version": "1.0",
  "goals": {
    "dynamic_programming": {
      "concept": "动态规划的状态与转移",
      "objective": "学习者能够定义状态、解释状态转移、处理边界，并判断新问题是否适合动态规划。",
      "success_thresholds": {"prerequisite": 0.6, "conceptual": 0.65, "procedural": 0.6, "transfer": 0.55},
      "max_rounds": 12,
      "materials": {
        "example": "爬 4 级楼梯，每次走 1 级或 2 级，共有多少种走法",
        "practice": "说明 dp[i] 的含义、递推来源和最小边界",
        "transfer_task": "判断最少硬币问题怎样定义状态，并说明最优子结构"
      }
    },
    "recursion": {
      "concept": "递归调用与终止条件",
      "objective": "学习者能够说明递归如何缩小问题、为何需要终止条件，并跟踪调用栈。",
      "success_thresholds": {"prerequisite": 0.6, "conceptual": 0.65, "procedural": 0.6, "transfer": 0.55},
      "max_rounds": 12,
      "materials": {
        "example": "计算 factorial(3) 时依次进入哪些调用",
        "practice": "写出 factorial 的终止条件和一次递归调用",
        "transfer_task": "判断树遍历递归需要保存哪些信息"
      }
    },
    "probability": {
      "concept": "互斥、独立与条件概率",
      "objective": "学习者能够区分互斥与独立，并在条件样本空间内解释概率。",
      "success_thresholds": {"prerequisite": 0.6, "conceptual": 0.65, "procedural": 0.6, "transfer": 0.55},
      "max_rounds": 10,
      "materials": {
        "example": "一次掷骰子中事件 A 为偶数，事件 B 为大于 4",
        "practice": "分别检查两个事件能否同时发生，以及一个发生是否改变另一个概率",
        "transfer_task": "判断抽牌事件是否互斥或独立"
      }
    },
    "python": {
      "concept": "Python 可变默认参数与对象共享",
      "objective": "学习者能够预测连续调用的状态，并解释默认对象何时创建。",
      "success_thresholds": {"prerequisite": 0.6, "conceptual": 0.65, "procedural": 0.6, "transfer": 0.55},
      "max_rounds": 10,
      "materials": {
        "example": "def add(x, box=[]): box.append(x); return box",
        "practice": "预测连续调用 add(1)、add(2) 的结果并解释对象关系",
        "transfer_task": "改写函数以避免调用间共享列表"
      }
    },
    "newton": {
      "concept": "牛顿第三定律中的作用力与反作用力",
      "objective": "学习者能够识别力对作用在不同物体上，并区分平衡力。",
      "success_thresholds": {"prerequisite": 0.6, "conceptual": 0.65, "procedural": 0.6, "transfer": 0.55},
      "max_rounds": 10,
      "materials": {
        "example": "人推墙时，人对墙和墙对人的两个力",
        "practice": "指出每个力的施力物体、受力物体和方向",
        "transfer_task": "分析书放在桌面时涉及的力对与平衡力"
      }
    },
    "fractions": {
      "concept": "分数除法为什么乘倒数",
      "objective": "学习者能够用单位量或方程解释分数除法，并正确计算。",
      "success_thresholds": {"prerequisite": 0.6, "conceptual": 0.65, "procedural": 0.6, "transfer": 0.55},
      "max_rounds": 10,
      "materials": {
        "example": "2/3 里面有多少个 4/5",
        "practice": "用方程 (4/5)x=2/3 解释求 x 的过程",
        "transfer_task": "解释 3/4 ÷ 2/5 的含义而不只背规则"
      }
    }
  },
  "student_profiles": {
    "example_first": {
      "profile_ref": "synthetic_multiturn_example_first",
      "learner_level": "beginner",
      "preferences": ["先用直观例子，再写公式"],
      "accessibility_needs": [],
      "initial_mastery": {"prerequisite": 0.45, "conceptual": 0.2, "procedural": 0.15, "transfer": 0.1},
      "known_misconceptions": [],
      "background_history": [],
      "conversation_history": [],
      "contains_direct_identity": false
    },
    "neutral_beginner": {
      "profile_ref": "synthetic_multiturn_neutral_beginner",
      "learner_level": "beginner",
      "preferences": ["一次只处理一步"],
      "accessibility_needs": [],
      "initial_mastery": {"prerequisite": 0.4, "conceptual": 0.2, "procedural": 0.15, "transfer": 0.1},
      "known_misconceptions": [],
      "background_history": [],
      "conversation_history": [],
      "contains_direct_identity": false
    },
    "profile_a_formula_averse": {
      "profile_ref": "synthetic_profile_a_formula_averse",
      "learner_level": "beginner",
      "preferences": ["不要先写公式", "用积木比喻"],
      "accessibility_needs": [],
      "initial_mastery": {"prerequisite": 0.3, "conceptual": 0.15, "procedural": 0.1, "transfer": 0.05},
      "known_misconceptions": [
        {
          "tag": "recursion_loop_equivalence",
          "description": "把递归和循环完全等同",
          "confidence": 0.8
        }
      ],
      "background_history": [],
      "conversation_history": [],
      "contains_direct_identity": false
    },
    "profile_b_symbolic": {
      "profile_ref": "synthetic_profile_b_symbolic",
      "learner_level": "intermediate",
      "preferences": ["可以直接使用符号和方程"],
      "accessibility_needs": [],
      "initial_mastery": {"prerequisite": 0.75, "conceptual": 0.6, "procedural": 0.55, "transfer": 0.4},
      "known_misconceptions": [],
      "background_history": [],
      "conversation_history": [],
      "contains_direct_identity": false
    }
  },
  "visual_evidence_catalog": {
    "clean_dp_printed": {
      "schema": "teaching_skill_miner.local_visual_evidence.v1",
      "source_modality": "image",
      "source_kind": "learner_answer_attachment",
      "display_name": "clean-dp.png",
      "mime_type": "image/png",
      "byte_size": 2048,
      "content_sha256": "aaaaaaaaaaaaaaaaaaaaaaaaaaaaaaaaaaaaaaaaaaaaaaaaaaaaaaaaaaaaaaaa",
      "engine": "synthetic_benchmark_ocr",
      "status": "recognized",
      "recognized_text": "Recursion is a prerequisite. Dynamic programming stores repeated subproblem results.",
      "confidence": 0.99,
      "confidence_semantics": "synthetic_high_contrast_printed_text",
      "formula_like_text_detected": false,
      "formula_accuracy_established": false,
      "extractor_fallback_used": false,
      "needs_student_confirmation": false,
      "raw_media_retained": false,
      "remote_media_sent": false,
      "remote_representation": "bounded_redacted_ocr_text_only"
    },
    "low_confidence_formula": {
      "schema": "teaching_skill_miner.local_visual_evidence.v1",
      "source_modality": "image",
      "source_kind": "learner_answer_attachment",
      "display_name": "handwritten-formula.png",
      "mime_type": "image/png",
      "byte_size": 3072,
      "content_sha256": "bbbbbbbbbbbbbbbbbbbbbbbbbbbbbbbbbbbbbbbbbbbbbbbbbbbbbbbbbbbbbbbb",
      "engine": "synthetic_benchmark_ocr",
      "status": "recognized",
      "recognized_text": "dp[i] = dp[i-1] + dp[i-2]",
      "confidence": 0.38,
      "confidence_semantics": "synthetic_low_confidence_formula_ocr",
      "formula_like_text_detected": true,
      "formula_accuracy_established": false,
      "extractor_fallback_used": false,
      "needs_student_confirmation": true,
      "raw_media_retained": false,
      "remote_media_sent": false,
      "remote_representation": "bounded_redacted_ocr_text_only"
    },
    "conflicting_ocr": {
      "schema": "teaching_skill_miner.local_visual_evidence.v1",
      "source_modality": "image",
      "source_kind": "learner_answer_attachment",
      "display_name": "conflict.png",
      "mime_type": "image/png",
      "byte_size": 2500,
      "content_sha256": "cccccccccccccccccccccccccccccccccccccccccccccccccccccccccccccccc",
      "engine": "synthetic_benchmark_ocr",
      "status": "recognized",
      "recognized_text": "x + 1",
      "confidence": 0.42,
      "confidence_semantics": "synthetic_low_confidence_formula_ocr",
      "formula_like_text_detected": true,
      "formula_accuracy_established": false,
      "extractor_fallback_used": false,
      "needs_student_confirmation": true,
      "raw_media_retained": false,
      "remote_media_sent": false,
      "remote_representation": "bounded_redacted_ocr_text_only"
    }
  },
  "episodes": [
    {
      "episode_id": "delayed_preference_recall",
      "category": "long_context_memory",
      "goal_ref": "dynamic_programming",
      "student_profile_ref": "example_first",
      "turns": [
        {"turn_id": "t1", "operation": "learner_turn", "learner_input": {"text": "我想先看具体例子，不要一上来就堆公式。递归我知道是把问题变小。", "visual_evidence_refs": []}, "gold": {"acceptable_signals": ["partial", "correct"], "allowed_primary_skill_ids": ["skill_concrete_example_bridge", "skill_contextual_problem_setup", "skill_concept_mapping"], "must_address_term_groups": [["例子", "具体情境", "爬楼梯"]], "recall_term_groups": [], "forbidden_output_terms": [], "direct_answer_terms": [], "profile_leakage_terms": [], "requires_visual_abstention": false, "expected_switch": true, "should_stop": false, "critical": false, "must_not_repeat_previous": false}},
        {"turn_id": "t2", "operation": "learner_turn", "learner_input": {"text": "在爬楼梯例子里，小问题可以是走到第 i 级有多少种方法。", "visual_evidence_refs": []}, "gold": {"acceptable_signals": ["correct", "partial"], "allowed_primary_skill_ids": ["skill_concept_mapping", "skill_stepwise_scaffolding", "skill_socratic_understanding_check"], "must_address_term_groups": [["第 i 级", "状态", "dp[i]"]], "recall_term_groups": [], "forbidden_output_terms": [], "direct_answer_terms": [], "profile_leakage_terms": [], "requires_visual_abstention": false, "expected_switch": null, "should_stop": false, "critical": false, "must_not_repeat_previous": false}},
        {"turn_id": "t3", "operation": "learner_turn", "learner_input": {"text": "最后一步可能走一级，也可能走两级。", "visual_evidence_refs": []}, "gold": {"acceptable_signals": ["correct", "partial"], "allowed_primary_skill_ids": ["skill_stepwise_scaffolding", "skill_practice_feedback", "skill_socratic_understanding_check"], "must_address_term_groups": [["一级", "两级", "两条路径"]], "recall_term_groups": [], "forbidden_output_terms": [], "direct_answer_terms": [], "profile_leakage_terms": [], "requires_visual_abstention": false, "expected_switch": null, "should_stop": false, "critical": false, "must_not_repeat_previous": false}},